{
  "schema_version": "1.0.0",
  "release_id": "tianshu-wave2-candidate-20260922",
  "status": "candidate",
  "products": {
    "platform": {
      "source": {
        "repo": "tianshu-platform",
        "commit": "fa85ee939a2affdda054ee7fa3155ec89ade6196"
      },
      "image": {
        "reference": "tianshu/platform:fa85ee939a2a",
        "digest": null,
        "verification": "unverified"
      },
      "service_role": "web_and_authority"
    },
    "companion": {
      "source": {
        "repo": "tianshu-companion",
        "commit": "cf020fd338b9beefc9d7156a00158e915d41735a"
      },
      "image": {
        "reference": "tianshu/companion:cf020fd338b9",
        "digest": null,
        "verification": "unverified"
      },
      "service_role": "dialogue_orchestrator"
    },
    "memory": {
      "source": {
        "repo": "tianshu-memory",
        "commit": "2f4037620f47991f42a5daa10f471c34c9ba4fd4"
      },
      "image": {
        "reference": "tianshu/memory:2f4037620f47",
        "digest": null,
        "verification": "unverified"
      },
      "service_role": "memory_authority"
    },
    "gateway": {
      "source": {
        "repo": "tianshu-model-gateway",
        "commit": "51121e6c02ed60605be14f31b19b484bc117a746"
      },
      "image": {
        "reference": "tianshu/gateway:51121e6c02ed",
        "digest": null,
        "verification": "unverified"
      },
      "service_role": "model_router"
    }
  },
  "contracts": [
    {
      "id": "text-dialogue/v1",
      "path": "contracts/text-dialogue/v1",
      "manifest_sha256": "0f9880a1bfb151eb7ec48db1c086d779c99c972c51933de0501d77da535605f8",
      "files": [
        {
          "path": "compatibility.md",
          "sha256": "283126310906acc6c1beb8a8cf59ce5982ddffc1d0b4ba689c1ef71045aa20ea"
        },
        {
          "path": "examples/documents.json",
          "sha256": "7ff8da16faf3277cb996107d5909fbe452c9202eac6a0277fd9c7da4ed4f1fe1"
        },
        {
          "path": "examples/negative-documents.json",
          "sha256": "2feae6a24bf9e0cd09510386c110b929e44912e1a46dfb7c49d727046d7b940a"
        },
        {
          "path": "examples/relations.json",
          "sha256": "f39bff8a23a516d69b8af764b39741248312fd60b492c2204a99395e1f274395"
        },
        {
          "path": "manifest.json",
          "sha256": "0f9880a1bfb151eb7ec48db1c086d779c99c972c51933de0501d77da535605f8"
        },
        {
          "path": "README.md",
          "sha256": "a26361d1064062a6a2f5410a9e5fe578fbf232d35eb377a22f13ac87a174e629"
        },
        {
          "path": "schemas/common.json",
          "sha256": "b296a79d7eb0218d9b444c4ddbba837ad576f46a7a4e50fbcebec7618d8ef9af"
        },
        {
          "path": "schemas/conversation.json",
          "sha256": "e640040fa816100b258999087f8784d1e7d1d55df007992632e202e02b64b6cb"
        },
        {
          "path": "schemas/identity-memory.json",
          "sha256": "7e32e26aea89cc88fb48f9d0af43f32ea68de8561404ff495d3a8044985ef848"
        },
        {
          "path": "schemas/model.json",
          "sha256": "9ffa9055aca897ff57292555f37674d79df687d1d6c062df48267527a8ff3a7c"
        },
        {
          "path": "schemas/web.json",
          "sha256": "6d1be804b1ff3e0fd63d776cea6c1615455923c4b1fe7782fd52202713cc333c"
        },
        {
          "path": "semantics.md",
          "sha256": "19f3ea3ce83bc997dac92846aea3e872d22d7ac34cf9adcc2c76708c24b4139e"
        }
      ]
    },
    {
      "id": "profile-memory/v1",
      "path": "contracts/profile-memory/v1",
      "manifest_sha256": "20ef6f36b64e39080101e1186672dbc9e5b20529e0c56971e1cc5a2880fe6048",
      "files": [
        {
          "path": "examples.json",
          "sha256": "bd55f3f392642a358cde7162ed1355edd58b1c3a550c46fb47d5c252b0a03cd2"
        },
        {
          "path": "manifest.json",
          "sha256": "20ef6f36b64e39080101e1186672dbc9e5b20529e0c56971e1cc5a2880fe6048"
        },
        {
          "path": "README.md",
          "sha256": "097c6fd35c1b2d516f4529fcd5080586c80e587bc6794f1da506498dffd5788b"
        },
        {
          "path": "schemas/profiles.json",
          "sha256": "a442cc60ef91b06c1eed65c7d0f40a691f81f131d68f14dba1d4552b95d0a56d"
        },
        {
          "path": "semantics.md",
          "sha256": "9a45bc352e1bfc63b9d94e1c1916470d652e45c425adf8595fa755d23d98ca49"
        },
        {
          "path": "validate.py",
          "sha256": "4fbff50a03eabffe75f46fc717d95214051e4146f93c3a8fb174e6e69f6ee549"
        }
      ]
    },
    {
      "id": "source-sync/v1",
      "path": "contracts/source-sync/v1",
      "manifest_sha256": "178d0ce66210bdfad4cfb85d8b5f0905b0b67f834e2a530efe5636ff0373633d",
      "files": [
        {
          "path": "compatibility.md",
          "sha256": "be0cd61080662554fedf66a8875d8bd20da0c888636195544452ea0f2f73d89e"
        },
        {
          "path": "examples/documents.json",
          "sha256": "5c923bc322f38ba58330cade3c97659963749650addf4337288b83d84359c50d"
        },
        {
          "path": "examples/negative-documents.json",
          "sha256": "c0301b7e7fe9c590b29d39cce54e1d78f418f00d15ef7adb004e29d204db4ce2"
        },
        {
          "path": "examples/relations.json",
          "sha256": "173c2c8ed2dc6651e76cded66b8fa6ea2cd6bd98c3c872165bf579faa3912c96"
        },
        {
          "path": "interfaces.json",
          "sha256": "e771ef7aee1caeecf7fba3b154274cde80256f27d6822e616e6d1dd42d30ddef"
        },
        {
          "path": "manifest.json",
          "sha256": "178d0ce66210bdfad4cfb85d8b5f0905b0b67f834e2a530efe5636ff0373633d"
        },
        {
          "path": "README.md",
          "sha256": "e36f925af0298bf868a564b7b4300cbcdc97889149db8cad5bcad0ddca984a79"
        },
        {
          "path": "rules.py",
          "sha256": "69eecf03bcdfb6904d02b597fd46ad1938d7d5e3a7eb4838159d081156dacfb8"
        },
        {
          "path": "schemas/shared.json",
          "sha256": "24b0c297007651ac4a3821cc41d68f8d6e7460d911cd42c4e4edc30b84b1d76d"
        },
        {
          "path": "schemas/sources.json",
          "sha256": "48749a31638f0d81e7ac9528ed3f3fc78400519409d2832ec77e0816e2d311fd"
        },
        {
          "path": "schemas/workflow.json",
          "sha256": "01424adddaf3d838337d37d0d1c0a58ccfb56ed7c984899c0602d37a86bf6e28"
        },
        {
          "path": "semantics.md",
          "sha256": "4de65d52931b53e16079403ae3e4a65b0e718ea330a126e713afc638f65f5a92"
        },
        {
          "path": "validate.py",
          "sha256": "9f63cf90dc2541d611210124cbf042d53bb5aae7ffd395a02e0f97823504b988"
        }
      ]
    },
    {
      "id": "web-conversation/v1",
      "path": "contracts/web-conversation/v1",
      "manifest_sha256": "e493a1b5d0f4cec8d55995553faf84042f4c33a59365d15423e57f4dc70a6c09",
      "files": [
        {
          "path": "authorization-examples.json",
          "sha256": "0ffecb85fe8f3b1773c4788aa887fff0c9ba964440b9b53733efd7b6f26a9649"
        },
        {
          "path": "examples.json",
          "sha256": "21a7e99d3d063e62026b7c5165016921a6f9d90109959104e1287f7ce85118de"
        },
        {
          "path": "manifest.json",
          "sha256": "e493a1b5d0f4cec8d55995553faf84042f4c33a59365d15423e57f4dc70a6c09"
        },
        {
          "path": "negative-examples.json",
          "sha256": "3806c1fced4084ec085929f58952d3daf28f2eb01484e7ef5a22000161a05b67"
        },
        {
          "path": "README.md",
          "sha256": "3e95c73dddf4e4beec76b8de94b1404267dd43a1b1a947b3ed20cd7e34e52405"
        },
        {
          "path": "schema.json",
          "sha256": "d2c6925fc55a471a96b89687812266dadc4214e8b904639f7c0220c6144f2316"
        },
        {
          "path": "semantics.md",
          "sha256": "20559fdf482050d1cd2ff0ce1053f44f7587cfa7752cbfb950d539dd530ee5d5"
        },
        {
          "path": "validate.py",
          "sha256": "751c3209a00c2fa62d7e104be6f21b6af2fa3e4a85620a243ffe7e24c0792967"
        }
      ]
    },
    {
      "id": "model-protocol/v1",
      "path": "contracts/model-protocol/v1",
      "manifest_sha256": "52711a71de56dbceebd1d5d96b2baf59a2d9551168029972d59111480f815141",
      "files": [
        {
          "path": "compatibility.md",
          "sha256": "32cfba5f8fbca8e6ef9aff7ab871931dd82b0d596eeb40030542d5bcc6ca4dc3"
        },
        {
          "path": "errors.json",
          "sha256": "e7a155ee5b5b058eb8d9d1195f0ee6887aff9ed94099b39939c76cb880996fa3"
        },
        {
          "path": "examples/documents.json",
          "sha256": "385414cc43fe07df1f19d561926ece8f6c44d3018cccd307d936fd33cd663428"
        },
        {
          "path": "examples/negative-documents.json",
          "sha256": "99cdcf4305ed2b0c12b5778311b6eeee282be3d5027ffddcdb30c56219bd99a9"
        },
        {
          "path": "examples/relations.json",
          "sha256": "1c3f18bb29b2023280419bb47e7a02151ba1dc1668f691d32a77d94d3aad5ff1"
        },
        {
          "path": "interfaces.json",
          "sha256": "312d0610f24b19407c205d293e4f282de5e4f497c17aa383692cd408250372d0"
        },
        {
          "path": "manifest.json",
          "sha256": "52711a71de56dbceebd1d5d96b2baf59a2d9551168029972d59111480f815141"
        },
        {
          "path": "README.md",
          "sha256": "963b6c561fddb5796f3eb3e2a7311565630cf63d3740379607fa43843e16773f"
        },
        {
          "path": "requirements.txt",
          "sha256": "9cba6d4508d006391ab899893990d5ac5d03b4811a0f71f152c5883897ee8120"
        },
        {
          "path": "schemas/model.json",
          "sha256": "de715187a3e99a8dffd2afb55c35d610328031c1cceae5d471088a74c143dd0f"
        },
        {
          "path": "semantics.md",
          "sha256": "df9f6e5286ef77b66a8c4aab76b9ff805dc7804dd0a91143f619e465b8620568"
        },
        {
          "path": "test_validator.py",
          "sha256": "1cbefa0b3c096caff4708826a442c50eca3004f4fdd206b7782356a3177a3dea"
        },
        {